categoria_evento;città;via;data_creazione;descrizione;data_pubblicazione;email;inizio;fine;immagine;desc_img;data_ultima_modifica;nome_sede;orari;patrocinato_da;prezzo;reperibilita;telefono;nome;extrainfo;web;giornata_intera;cap;pagina_web;latitudine;longitudine;geometry
Mostre;Modena;Largo Porta S.Agostino, 337;2021-05-25T13:19:14+00:00;Mostra sulla riscoperta della raccolta del Paleolitico francese del Museo Civico di Modena;2021-05-25T13:24:04+00:00;museocivico@comune.modena.it;2021-05-15T13:00:00+00:00;2022-06-19T14:00:00+00:00;https://www.comune.modena.it/api/novita/eventi/primordi/@@images/1b0ed109-3d3b-4775-8ae3-add6e0f1d15c.jpeg;;2021-08-31T13:28:15+00:00;Museo civico di Modena; Dal martedì al venerdì ore 9.00-12.00  sabato, domenica e festivi ore 10 – 19;; Ingresso gratuito con accesso contingentato, si consiglia la prenotazione ;;059 2033100;Primordi;;https://www.museocivicomodena.it;False;41121;https://www.comune.modena.it/novita/eventi/primordi;44,64832251199191;10,920876975440427;POINT (10.920876975440427 44.64832251199191)
Mostre;Modena;corso Canalgrnde, 103;2021-09-09T10:12:02+00:00;;2021-09-09T10:12:26+00:00;info@fmav.org - biglietteria@fmav.org;2022-03-04T11:00:00+00:00;2022-06-05T11:00:00+00:00;https://www.comune.modena.it/api/novita/eventi/2022/le-avventure-di-aldo-archivi-come-connessione-di-tempi/@@images/bcf3640a-ee81-4ced-86fc-bace3c7c0a72.jpeg;;2022-02-18T11:38:39+00:00;FMAV - Palazzo Santa Margherita; Da mercoledì a venerdì ore 11–13 e 16–19  sabato, domenica e festivi ore 11-19;; biglietto intero 6 € / ridotto 4 € (Circuito Vivaticket)   Biglietto cumulativo: DecompressedPrism + Le avventure di Aldo + Strade: 12 €  ingresso libero ogni mercoledì ;;In orario di mostra: Palazzo Santa Margherita 059 2033166;Le avventure di Aldo. Archivi come connessione di tempi;;https://www.fmav.org;False;41121;https://www.comune.modena.it/novita/eventi/2022/le-avventure-di-aldo-archivi-come-connessione-di-tempi;44,64582;10,92572;POINT (10.92572 44.64582)
Mostre;Modena;corso Canalgrnde, 103;2021-09-09T10:12:02+00:00;;2021-09-09T10:12:26+00:00;info@fmav.org - biglietteria@fmav.org;2022-03-04T11:00:00+00:00;2022-06-05T11:00:00+00:00;https://www.comune.modena.it/api/novita/eventi/2022/salvatore-vitale-decompressed-prism/@@images/82b90fe6-3299-447e-bd81-4d29ec1b24ab.jpeg;;2022-02-18T11:39:35+00:00;FMAV - Palazzo Santa Margherita; Da mercoledì a venerdì ore 11–13 e 16–19  sabato, domenica e festivi ore 11-19;; biglietto intero 6 € / ridotto 4 € (Circuito Vivaticket)   Biglietto cumulativo: DecompressedPrism + Le avventure di Aldo + Strade: 12 €   ;;In orario di mostra: Palazzo Santa Margherita 059 2032919;Salvatore Vitale. Decompressed Prism;;https://www.fmav.org;False;41121;https://www.comune.modena.it/novita/eventi/2022/salvatore-vitale-decompressed-prism;44,64582;10,92572;POINT (10.92572 44.64582)
Mostre;Modena;Largo Porta Sant’Agostino, 337;2022-03-19T08:51:24+00:00;I santi eremiti della Galleria Estense e della Certosa di Pavia;2022-03-19T08:58:42+00:00;ga-esten@beniculturali.it;2022-03-25T08:00:00+00:00;2022-06-26T08:00:00+00:00;https://www.comune.modena.it/api/novita/eventi/2022/copy_of_indagini-intorno-a-giovanni-serodine-1600-1630/@@images/237f2251-5f65-4381-a52c-de34e5f41042.jpeg;;2022-05-06T07:36:05+00:00;Galleria Estense; dal martedì al sabato 8.30 – 19.30  domenica e festivi 10 – 18  chiuso martedì 19 aprile 2022;;;;059 4395711;Indagini intorno a Giovanni Serodine (1600-1630);;https://gallerie-estensi.beniculturali.it/;False;41123;https://www.comune.modena.it/novita/eventi/2022/copy_of_indagini-intorno-a-giovanni-serodine-1600-1630;44,64582;10,92572;POINT (10.92572 44.64582)
Mostre;Modena;Largo Porta Sant’Agostino, 337;2022-03-19T08:51:24+00:00;;2022-03-19T08:58:42+00:00;ga-esten@beniculturali.it;2022-05-06T07:00:00+00:00;2022-11-06T09:00:00+00:00;https://www.comune.modena.it/api/novita/eventi/2022/tra-acqua-e-vento-un-modello-di-bernini-ospite-in-galleria-estense/@@images/6c7215e9-a330-4fd7-b565-c383e5da0d06.jpeg;;2022-05-06T08:01:39+00:00;Galleria Estense; da martedì a sabato 8.30 – 19.30  domenica e festivi 10.00 – 18.00;;;;059 4395711;Tra acqua e vento. Un modello di Bernini ospite in Galleria Estense;;https://gallerie-estensi.beniculturali.it/;False;41123;https://www.comune.modena.it/novita/eventi/2022/tra-acqua-e-vento-un-modello-di-bernini-ospite-in-galleria-estense;44,64582;10,92572;POINT (10.92572 44.64582)
Mostre;Modena;;2022-05-03T07:47:18+00:00;Esposizione interattiva;2022-05-03T07:47:41+00:00;;2022-05-13T07:00:00+00:00;2022-09-20T08:00:00+00:00;https://www.comune.modena.it/api/novita/eventi/2022/illusion-niente-e-come-sembra/@@images/a90fcc28-9ba2-432e-b6a7-7e1aa65d6d93.jpeg;"Installazione ""DELICATE BOUNDARIES di Chris Sugrue (US)";2022-05-13T14:22:43+00:00;Nuovo Diurno (piazza Mazzini) e Laboratorio Aperto (viale Buon Pastore, 43); Inaugurazione venerdì 13 maggio e apertura al pubblico dalle ore 16 presso il Nuovo Diurno  Ex-Diurno, Piazza Mazzini: dal martedì alla domenica dalle 9 alle 20 Laboratorio aperto, viale Buon Pastore 43: dal lunedì al  venerdì, dalle 10 alle 13 e dalle 14 alle 18 ;;;;;Illusion: niente è come sembra;;;False;41123;https://www.comune.modena.it/novita/eventi/2022/illusion-niente-e-come-sembra;44,64582;10,92572;POINT (10.92572 44.64582)
Mostre;Modena;corso Canalgrande, 103;2022-05-09T09:20:03+00:00;Mostra delle tavole originali di Rocco Lombardi;2022-05-09T09:20:10+00:00;;2022-05-13T09:00:00+00:00;2022-06-25T10:00:00+00:00;https://www.comune.modena.it/api/novita/eventi/2022/cera-una-taiga-cera-un-incendio/@@images/ee309d65-a044-4f9f-9654-b7cd4cf48471.jpeg;;2022-05-09T09:21:01+00:00;Biblioteca Delfini; Venerdì 13 maggio, inaugurazione ore 18. Dal 14 maggio: lunedì 14:30-20:00, da martedì a sabato 9:30-20:00 ;;;;;C'era una taiga. C'era un incendio;;;False;41123;https://www.comune.modena.it/novita/eventi/2022/cera-una-taiga-cera-un-incendio;44,64582;10,92572;POINT (10.92572 44.64582)
Mostre;Modena;piazza Grande, 17;2022-05-14T08:53:22+00:00;;2022-05-14T08:53:32+00:00;;2022-05-14T08:00:00+00:00;2022-06-03T09:00:00+00:00;https://www.comune.modena.it/api/novita/eventi/2022/lue-zona-di-liberta-lgbtiq/@@images/3cc471ca-e6d6-43a6-b1cd-10e277757659.jpeg;;2022-05-14T08:54:11+00:00;Galleria Europa; lunedì e giovedì 9.00-13.00 e 14.00-18.00 martedì, mercoledì, venerdì e sabato 9.00–13.00  ;;;;;L'UE zona di libertà LGBTIQ;;;False;41123;https://www.comune.modena.it/novita/eventi/2022/lue-zona-di-liberta-lgbtiq;44,64582;10,92572;POINT (10.92572 44.64582)
Mostre;Modena;via Selmi, 63;2022-05-13T10:35:21+00:00;;2022-05-13T10:35:30+00:00;;2022-05-14T10:00:00+00:00;2022-06-19T11:00:00+00:00;https://www.comune.modena.it/api/novita/eventi/2022/dalle-cose-altri-miraggi-i-collage-di-gianni-valbonesi/@@images/2017dd44-6be2-4497-a46b-9005dcca2629.jpeg;;2022-05-26T07:15:27+00:00;Complesso San Paolo; Il venerdì 16-20  il sabato e la domenica 10-13 e 16-20. Sabato 14 maggio, in occasione della Notte Europea dei Musei, e sabato 18 giugno, per la Festa della musica, l’apertura sarà prolungata fino alle 22.30;;;;;Dalle cose altri miraggi - I collage di Gianni Valbonesi;;;False;41123;https://www.comune.modena.it/novita/eventi/2022/dalle-cose-altri-miraggi-i-collage-di-gianni-valbonesi;44,64582;10,92572;POINT (10.92572 44.64582)
Mostre;Modena;via L.A. Vincenzi, 2 angolo viale A.Tassoni, 6;2022-05-19T08:37:40+00:00;Personale di Michele Ferri;2022-05-19T08:38:52+00:00;info@accademia-adac.it;2022-05-20T08:00:00+00:00;2022-06-18T09:00:00+00:00;https://www.comune.modena.it/api/novita/eventi/2022/cacciacuore/@@images/c3becf44-09a6-448b-9405-846c99156b8c.jpeg;;2022-05-19T08:38:52+00:00;Adac - Accademia delle arti creative; inaugurazione venerdì 20 maggio ore 19. Orari mostra: dal lunedì al venerdì ore 10-19  sabato ore 10-18.30 ;; ingresso libero;;328 5366455;Cacciacuore;;https://accademia-adac.it;False;41123;https://www.comune.modena.it/novita/eventi/2022/cacciacuore;44,64582;10,92572;POINT (10.92572 44.64582)
Fiere, Esposizioni e Mostre Mercato,Mercati;Modena;via Pio la Torre, 61;2022-03-09T08:45:48+00:00;;2022-03-09T08:46:01+00:00;;2022-05-01T07:00:00+00:00;2022-05-29T08:00:00+00:00;https://www.comune.modena.it/api/novita/eventi/2022/copy2_of_le-bancarelle-mercatino-delle-pulci/@@images/a63ccccb-06ba-46bd-91d1-d91429409bf3.jpeg;;2022-03-09T10:40:46+00:00;Polivalente 87 & Gino Pini; Domenica dalle ore 9 alle 13;;;;;Le bancarelle - Mercatino delle pulci;;https://www.facebook.com/littlemarketitalia/;False;41123;https://www.comune.modena.it/novita/eventi/2022/copy2_of_le-bancarelle-mercatino-delle-pulci;44,64582;10,92572;POINT (10.92572 44.64582)
Mostre;Modena;via Torre, 65;2022-05-26T07:31:08+00:00;;2022-05-26T07:31:35+00:00;;2022-05-22T07:00:00+00:00;2022-06-04T08:00:00+00:00;https://www.comune.modena.it/api/novita/eventi/2022/facing-you-personale-di-ersilia-leonini/@@images/86fe7255-e33a-401b-9ab1-c673614beb11.jpeg;;2022-05-26T07:31:35+00:00;Artekyp; tutti i giorni 10-12.30 e 16.30-19;;;;;"""Facing you"" - personale di Ersilia Leonini";;;False;41123;https://www.comune.modena.it/novita/eventi/2022/facing-you-personale-di-ersilia-leonini;44,64582;10,92572;POINT (10.92572 44.64582)
Mostre;Modena;via San Carlo, 7;2022-05-26T07:55:17+00:00;;2022-05-26T07:55:24+00:00;;2022-05-26T07:00:00+00:00;2022-07-10T08:00:00+00:00;https://www.comune.modena.it/api/novita/eventi/2022/punti-incrociati-moda-motori-design/@@images/4d58d6b3-9a64-4d3d-bd6d-b8f4bad3ad1f.jpeg;;2022-05-27T14:17:16+00:00;Chiesa di San Carlo; fino al 29 maggio ore 10-20. Dal 31 maggio al 10 luglio: dal martedì al venerdì ore 16-20  sabato e domenica ore 10-13 e 16-20;;;;;Punti incrociati: moda, motori, design;;;False;41123;https://www.comune.modena.it/novita/eventi/2022/punti-incrociati-moda-motori-design;44,64582;10,92572;POINT (10.92572 44.64582)
Altri eventi,Fiere, Esposizioni e Mostre Mercato,Manifestazioni sportive,Iniziative per bambini;Modena;;2022-05-17T09:05:44+00:00;Esibizioni, karting per i bambini, incontri tematici, esposizioni di auto sono in programma dal 26 al 29 maggio;2022-05-17T09:05:52+00:00;;2022-05-26T08:00:00+00:00;2022-05-29T09:00:00+00:00;https://www.comune.modena.it/api/novita/eventi/2022/motor-valley-fest-quarta-edizione/@@images/b4ee995e-3238-4045-932b-c7b1819db8ce.jpeg;;2022-05-26T08:03:12+00:00;; vedi orari nel programma: motorvalley.it/motorvalleyfest;;;;;Motor Valley Fest - Quarta edizione;;;False;41123;https://www.comune.modena.it/novita/eventi/2022/motor-valley-fest-quarta-edizione;44,64582;10,92572;POINT (10.92572 44.64582)
Altri eventi;Modena;via degli Adelardi, 4;2021-04-28T06:30:25+00:00;Proiezione del film di Alejandro Amenábar;2021-04-28T06:30:52+00:00;;2022-05-28T06:00:00+00:00;2022-05-29T06:44:31+00:00;https://www.comune.modena.it/api/novita/eventi/2022/lettera-a-franco/@@images/6ebf8ebc-3cd9-4679-8c2f-a39d252bcdeb.jpeg;Immagine della locandina del film;2022-05-24T07:35:24+00:00;Sala Truffaut; sabato ore 21.15  domenica ore 18.15 e 20.45;;;;059 236288;Lettera a Franco;;https://www.circuitocinema.mo.it/sala-truffaut/;False;41121;https://www.comune.modena.it/novita/eventi/2022/lettera-a-franco;44,6456499931615;10,921599972490952;POINT (10.921599972490952 44.6456499931615)
Conferenze, Seminari, Incontri e Lezioni;Modena;Corso Canalgrande, 103;2022-05-05T08:41:26+00:00;Appuntamenti letterari al femminile;2022-05-05T09:23:17+00:00;;2022-05-07T07:00:00+00:00;2022-05-28T08:00:00+00:00;https://www.comune.modena.it/api/novita/eventi/2022/scrittrici-inchiostro/@@images/318772ef-8170-4984-9e11-f2516c109708.jpeg;;2022-05-05T09:23:17+00:00;Chiostro di Palazzo Santa Margherita; i sabati di maggio alle ore 18;;;;;Scrittrici inChiostro;;;False;41123;https://www.comune.modena.it/novita/eventi/2022/scrittrici-inchiostro;44,64582;10,92572;POINT (10.92572 44.64582)
Conferenze, Seminari, Incontri e Lezioni,Altri eventi,Iniziative per bambini;Modena;Viale Jacopo Barozzi, 31;2021-05-13T08:16:32+00:00;Conferenze, eventi per famiglie, serate speciali e visite guidate;2021-05-13T08:16:59+00:00;info@planetariodimodena.it;2022-05-22T07:00:00+00:00;2022-05-29T09:11:35+00:00;https://www.comune.modena.it/api/novita/eventi/2022/copy7_of_le-iniziative-al-planetario/@@images/bce50dab-bfa1-40ef-9085-04f7bab6d51d.jpeg;Immagine del pianeta Terra - da unsplash.com;2022-05-17T08:44:09+00:00;Civico Planetario; domenica 22 e domenica 29 maggio ore 15  giovedì 26 maggio ore 21  sabato 28 maggio ore 21;; a pagamento  vedi costo del biglietto nel programma o sul sito del Planetario: www.planetariodimodena.it ;;059 224726;Le iniziative al Planetario;;https://www.planetariodimodena.it;False;41123;https://www.comune.modena.it/novita/eventi/2022/copy7_of_le-iniziative-al-planetario;44,64907001920466;10,917829960080724;POINT (10.917829960080724 44.64907001920466)
Concerti,Musica;Modena;via  San Pietro, 7;2022-05-26T07:38:49+00:00;Concerto della rassegna Vox Mutinae 2022;2022-05-26T07:38:55+00:00;;2022-05-28T07:00:00+00:00;2022-05-28T08:00:00+00:00;https://www.comune.modena.it/api/novita/eventi/2022/recital-lirico-dei-vincitori-del-concorso-internazionale-di-canto-lirico-intitolato-a-nicolaj-ghiaurov/@@images/d4a31c90-0423-433c-acbe-2cfbe2df77b8.jpeg;Giorgi Manoshvili;2022-05-26T07:39:15+00:00;Auditorium Santa Scolastica, presso il Monastero di San Pietro; ore 18.00;; ingresso gratuito;;;Recital lirico dei vincitori del Concorso Internazionale di canto lirico intitolato a Nicolaj Ghiaurov;;;False;41123;https://www.comune.modena.it/novita/eventi/2022/recital-lirico-dei-vincitori-del-concorso-internazionale-di-canto-lirico-intitolato-a-nicolaj-ghiaurov;44,64582;10,92572;POINT (10.92572 44.64582)
Altri eventi,Iniziative per bambini;Modena;via Selmi, 63;2022-05-17T07:24:22+00:00;;2022-05-17T07:25:56+00:00;;2022-05-28T07:00:00+00:00;2022-06-11T08:00:00+00:00;https://www.comune.modena.it/api/novita/eventi/2022/copy_of_laboratori-artistici-in-occasione-della-mostra-dedicata-a-gianni-valbonesi/@@images/faf8f0b5-e078-4310-9f19-8f71719228e5.jpeg;;2022-05-26T07:20:15+00:00;Complesso San Paolo; sabato 28 maggio e sabato 11 giugno dalle ore 10 alle 12.30;; Iscrizione su prenotazione, è richiesto un contributo di 3€ a partecipante.  ;;;Laboratori artistici in occasione della mostra dedicata a Gianni Valbonesi;;;False;41123;https://www.comune.modena.it/novita/eventi/2022/copy_of_laboratori-artistici-in-occasione-della-mostra-dedicata-a-gianni-valbonesi;44,64582;10,92572;POINT (10.92572 44.64582)
Visite guidate;Modena;centro storico;2022-04-29T10:05:46+00:00;Visite straordinarie, dalle 19 alle 22, il venerdì, sabato e domenica, dal 1 maggio al 17 luglio.;2022-04-29T10:06:04+00:00;;2022-05-01T09:00:00+00:00;2022-07-17T10:00:00+00:00;https://www.comune.modena.it/api/novita/eventi/2022/torre-ghirlandina-aperture-serali/@@images/bfdf71f9-ed36-4565-8549-0084dd664317.jpeg;Torre Ghirlandina;2022-04-29T10:06:04+00:00;Piazza Torre; Dal 1 maggio al 17 luglio: tutti i venerdì, sabato e domenica dalle 19 alle 22 ;;;;;Torre Ghirlandina, aperture serali;;;False;41123;https://www.comune.modena.it/novita/eventi/2022/torre-ghirlandina-aperture-serali;44,64582;10,92572;POINT (10.92572 44.64582)
Mostre;Modena;via Emilia Centro angolo Piazza Matteotti;2022-05-13T10:01:30+00:00;;2022-05-13T10:03:13+00:00;;2022-05-28T09:00:00+00:00;2022-06-05T10:00:00+00:00;https://www.comune.modena.it/api/novita/eventi/2022/mostra-di-ricamo-e-merletto-da-ieri-a-oggi-la-tradizione-continua/@@images/fecdcb1a-b768-40a7-8809-d18fd2116bab.jpeg;;2022-05-13T10:03:32+00:00;Chiesa S.Giovanni Battista; dal lunedì al venerdì ore 10-18  sabato e domenica ore 10-19;;;;;"Mostra di ricamo e merletto ""Da ieri a oggi.....la tradizione continua""";;;False;41123;https://www.comune.modena.it/novita/eventi/2022/mostra-di-ricamo-e-merletto-da-ieri-a-oggi-la-tradizione-continua;44,64582;10,92572;POINT (10.92572 44.64582)
Altri eventi,Musica,Concerti;Modena;via San Pietro, 7;2022-05-26T10:59:44+00:00;;2022-05-26T10:59:52+00:00;;2022-05-28T10:00:00+00:00;2022-05-28T11:00:00+00:00;https://www.comune.modena.it/api/novita/eventi/2022/spezieria-tra-fiori-e-musica/@@images/8d9cb68d-b782-44cf-9f54-ba911c69ac27.jpeg;;2022-05-26T11:12:17+00:00;Spezieria del Monastero di S.Pietro; ore 17.00;;;;;Spezieria tra fiori e musica;;;False;41123;https://www.comune.modena.it/novita/eventi/2022/spezieria-tra-fiori-e-musica;44,64582;10,92572;POINT (10.92572 44.64582)
Visite guidate;Modena;ritrovo presso la biglietteria della Torre, piazza Torre;2022-02-25T14:15:15+00:00;Torre Ghirlandina, visite guidate a tema;2022-02-25T14:15:33+00:00;;2022-05-28T13:00:00+00:00;2022-05-28T14:00:00+00:00;https://www.comune.modena.it/api/novita/eventi/2022/dai-comacini-ai-maestri-campionesi/@@images/d5218bc2-dc59-43df-b1a3-4f32b072e82f.jpeg;Torre Ghirlandina;2022-02-28T15:10:52+00:00;Torre Ghirlandina; ore 19.00;;;;;Dai Comacini ai Maestri Campionesi;;;False;41123;https://www.comune.modena.it/novita/eventi/2022/dai-comacini-ai-maestri-campionesi;44,64582;10,92572;POINT (10.92572 44.64582)
Mostre;Modena;Via F. Selmi, 67;2022-05-27T13:32:13+00:00;Esposizione a tema a cura degli studenti della classe 3G dell'IIS A.Venturi di Modena;2022-05-27T13:32:23+00:00;;2022-05-28T13:00:00+00:00;2022-06-05T14:00:00+00:00;https://www.comune.modena.it/api/novita/eventi/2022/201cle-ferite201d-per-i-50-anni-di-medici-senza-frontiere/@@images/8d3225be-145b-4570-8501-7c691ae317e4.jpeg;;2022-05-27T14:11:04+00:00;Complesso San Paolo, Cortile del Leccio; sabato e feriali ore 9.00-19.00  domenica e festivi ore 9.00-13.00 ;;;;;“Le Ferite” per i 50 anni di Medici Senza Frontiere;;;False;41123;https://www.comune.modena.it/novita/eventi/2022/201cle-ferite201d-per-i-50-anni-di-medici-senza-frontiere;44,64582;10,92572;POINT (10.92572 44.64582)
Conferenze, Seminari, Incontri e Lezioni;Modena;Via F. Selmi, 67;2022-05-27T13:32:13+00:00;Presentazione del libro ed esposizione a tema a cura degli studenti della classe 3G dell'IIS A.Venturi di Modena;2022-05-27T13:32:23+00:00;;2022-05-28T13:00:00+00:00;2022-05-28T14:00:00+00:00;https://www.comune.modena.it/api/novita/eventi/2022/copy_of_201cle-ferite201d-per-i-50-anni-di-medici-senza-frontiere/@@images/c8a46615-786c-4007-9ec5-18ab3716c26a.jpeg;;2022-05-27T14:10:34+00:00;Complesso San Paolo, Cortile del Leccio; ore 16.30;;;;;“Le Ferite” per i 50 anni di Medici Senza Frontiere;;;False;41123;https://www.comune.modena.it/novita/eventi/2022/copy_of_201cle-ferite201d-per-i-50-anni-di-medici-senza-frontiere;44,64582;10,92572;POINT (10.92572 44.64582)
Visite guidate;Modena;Piazza Grande;2022-03-23T16:26:44+00:00;;2022-03-23T16:26:51+00:00;;2022-03-19T16:00:00+00:00;2022-05-28T16:00:00+00:00;https://www.comune.modena.it/api/novita/eventi/2022/free-walking-tour-visite-guidate-del-centro-storico-di-modena/@@images/26b88750-ac47-44ab-bc5c-66df7933f860.jpeg;;2022-03-23T16:27:28+00:00;Ritrovo e partenza: Piazza Grande, Pietra Ringadora; Tutti i sabati dal 19 marzo al 28 maggio alle ore 15.30;;;;;Free Walking Tour - Visite guidate del centro storico di Modena;;;False;41123;https://www.comune.modena.it/novita/eventi/2022/free-walking-tour-visite-guidate-del-centro-storico-di-modena;44,64582;10,92572;POINT (10.92572 44.64582)
Iniziative per bambini;Modena;piazza Matteotti, 17;2022-05-25T09:39:41+00:00;Spettacolo teatrale per bambini e bambine da 3 a 6 anni;2022-05-25T09:43:08+00:00;;2022-05-29T08:00:00+00:00;2022-05-29T10:00:00+00:00;https://www.comune.modena.it/api/novita/eventi/2022/un-viaggio-alla-scoperta-della-musica/@@images/c4306e19-428c-42cb-bc32-698e6ea5dd39.jpeg;;2022-05-25T09:43:08+00:00;Centro per l'infanzia Mo.Mo; Ore 10.00;; Inizia gratuita su prenotazione;;059 235320;Un viaggio alla scoperta della musica;;;False;41123;https://www.comune.modena.it/novita/eventi/2022/un-viaggio-alla-scoperta-della-musica;44,648090007085386;10,925069996586558;POINT (10.925069996586558 44.648090007085386)
Concerti,Musica;Modena;Largo S.Francesco;2022-05-10T10:04:48+00:00;Diciottesima edizione;2022-05-10T10:08:30+00:00;;2022-05-29T10:00:00+00:00;2022-05-29T11:00:00+00:00;https://www.comune.modena.it/api/novita/eventi/2022/concerto-rosa-mistica/@@images/5d666bc9-d035-4acb-9903-21fd8e9003bf.jpeg;;2022-05-10T10:13:42+00:00;Chiesa di San Francesco; ore 16.00;; Ingresso libero;;;"Concerto ""Rosa mistica""";;;False;41123;https://www.comune.modena.it/novita/eventi/2022/concerto-rosa-mistica;44,64582;10,92572;POINT (10.92572 44.64582)
Altri eventi,Iniziative per bambini,Visite guidate;Montale Rangone;Via Vandelli (Statale 12 – Nuova Estense);2021-04-26T15:03:43+00:00;Riapertura al pubblico tutte le domeniche e festivi dal 3 aprile al 19 giugno 2022;2021-04-26T15:06:06+00:00;museo@parcomontale.it;2022-04-03T14:00:00+00:00;2022-06-19T15:00:00+00:00;https://www.comune.modena.it/api/novita/eventi/2022/parco-archeologico-della-terramara-di-montale/@@images/f7d0a110-c97e-4787-b356-c6a2116576e3.jpeg;Parco archeologico della Terramara di Montale;2022-03-28T14:43:35+00:00;Parco archeologico della Terramara di Montale; Il Parco è aperto dal 3 aprile al 19 giugno, tutte le domeniche e nei giorni festivi di lunedì 18 aprile, lunedì 25 aprile e giovedì 2 giugno;; 7 euro intero, ridotto 5 euro dai 6 ai 13 anni,  gratuito fino a 5 anni e dai 65 anni  riduzione del 50% ai possessori della fidelity card del Parco;;Per informazioni e prenotazioni: tel. 335 8136948 dalle 9 alle 13 oppure 059 532020 negli orari di apertura del Parco;Parco archeologico della Terramara di Montale;;http://www.parcomontale.it/it;False;41050;https://www.comune.modena.it/novita/eventi/2022/parco-archeologico-della-terramara-di-montale;44,64582;10,92572;POINT (10.92572 44.64582)
Visite guidate;Modena;Piazza Grande;2022-03-23T16:26:44+00:00;;2022-03-23T16:26:51+00:00;;2022-05-29T15:00:00+00:00;2022-05-29T16:00:00+00:00;https://www.comune.modena.it/api/novita/eventi/2022/copy4_of_free-walking-tour-visite-guidate-tematiche/@@images/bbb27001-b4a3-4ea4-8c8f-b2ea069af5e6.jpeg;;2022-05-23T10:13:30+00:00;Ritrovo e partenza: Piazza Grande, Pietra Ringadora; ore 10.00;; Euro 12 a partecipante;;;Free Walking Tour - Visite guidate tematiche;;;False;41123;https://www.comune.modena.it/novita/eventi/2022/copy4_of_free-walking-tour-visite-guidate-tematiche;44,64582;10,92572;POINT (10.92572 44.64582)
Spettacoli,Teatro;Modena;Largo Garibaldi, 15;2022-05-26T10:41:07+00:00;Rassegna degli spettacoli degli studenti degli istituti scolastici superiori di Modena;2022-05-26T10:43:09+00:00;;2022-05-25T10:00:00+00:00;2022-05-31T11:00:00+00:00;https://www.comune.modena.it/api/novita/eventi/2022/teatro-di-classe/@@images/e2c8fdee-bd18-4665-a203-859f06d4c9ae.jpeg;Teatro Storchi;2022-05-26T10:43:09+00:00;Teatro Storchi; ore 21.00;; Prezzi dei biglietti € 8 ;;;Teatro di classe;;;False;41123;https://www.comune.modena.it/novita/eventi/2022/teatro-di-classe;44,64582;10,92572;POINT (10.92572 44.64582)
Altri eventi,Mercati;Modena;Ingresso da viale Berengario;2020-12-29T15:02:32+00:00;;2020-12-29T15:05:00+00:00;;2022-01-03T14:00:00+00:00;2022-12-26T14:59:00+00:00;https://www.comune.modena.it/api/novita/eventi/2022/mercato-settimanale-del-lunedi-1/@@images/44cdb524-15a5-405b-89af-f9e36f3adeb6.jpeg;;2021-12-28T10:39:07+00:00;Parco Novi Sad; il lunedì dalle ore 8 alle 14;;;;;Mercato settimanale del lunedì;;http://www.consorzioilmercato.com/;False;41121;https://www.comune.modena.it/novita/eventi/2022/mercato-settimanale-del-lunedi-1;44,64582;10,92572;POINT (10.92572 44.64582)
Spettacoli,Teatro;Modena;Viale Caduti in Guerra, 196;2020-09-17T12:45:54+00:00;Gli spettacoli di ERT al Teatro Tempio;2014-09-30T12:50:00+00:00;info@emiliaromagnateatro.com;2022-05-30T22:00:00+00:00;2022-06-12T21:55:00+00:00;https://www.comune.modena.it/api/novita/eventi/2022/kassandra/@@images/29f75f21-a9f0-45e8-8056-8023ce88a666.jpeg;;2022-03-15T11:11:12+00:00;Teatro Tempio; 31 maggio e 1 giugno, 3 giugno e dal 7 al 10 giugno ore 20.30  2, 4, 5, 11 e 12 giugno ore 19.00;; A pagamento, vedi nel testo le info per l'acquisto dei biglietti.;;059/2163021;Kassandra;;http://www.emiliaromagnateatro.com;False;;https://www.comune.modena.it/novita/eventi/2022/kassandra;44,64381951149482;10,93139345085676;POINT (10.93139345085676 44.64381951149482)
Altri eventi;Modena;via degli Adelardi, 4;2021-04-28T06:30:25+00:00;Proiezione del film di Francesco Conversano e Nene Grignaffini;2021-04-28T06:30:52+00:00;;2022-05-31T06:00:00+00:00;2022-05-31T06:44:31+00:00;https://www.comune.modena.it/api/novita/eventi/2022/paisan-ciao/@@images/00f14156-0e06-4604-8c79-4aa96ada1a7a.jpeg;Immagine della locandina del film;2022-05-24T07:41:04+00:00;Sala Truffaut; ore 21.15;;;;059 236288;Paisan, Ciao;;https://www.circuitocinema.mo.it/sala-truffaut/;False;41121;https://www.comune.modena.it/novita/eventi/2022/paisan-ciao;44,6456499931615;10,921599972490952;POINT (10.921599972490952 44.6456499931615)
Musica,Spettacoli,Teatro;Modena;Corso Canalgrande, 85;2021-10-04T15:31:48+00:00;Spettacolo conclusivo dei corsi di Alta Formazione per cantanti lirici ;2021-10-04T15:31:55+00:00;info@teatrocomunalemodena.it;2022-05-31T15:00:00+00:00;2022-05-31T16:00:00+00:00;https://www.comune.modena.it/api/novita/eventi/2022/dolceamaro/@@images/2429e532-09b0-41e8-9f85-aa4a21287d10.jpeg;;2022-03-22T10:17:19+00:00;Teatro comunale Pavarotti-Freni; ore 21.00;; gratuito;;059 2033010;DolceAmaro;;https://teatrocomunalemodena.it/;False;41123;https://www.comune.modena.it/novita/eventi/2022/dolceamaro;44,64582;10,92572;POINT (10.92572 44.64582)
